{
  "schema_version": 1,
  "project": "AI Commerce Marketing Platform",
  "milestone": "Stage 06 Decision Engine",
  "current_stage": "stage-06-runtime",
  "stage_status": "partial",
  "active_pr": {
    "number": 73,
    "title": "feat(stage06): add FAKE decision engine runtime",
    "draft": true,
    "state": "open"
  },
  "ci_status": "passing",
  "manager_gate": "APPROVE",
  "voice_manager_decision": "APPROVED",
  "conditions": [],
  "blockers": [],
  "human_action_required": false,
  "human_action_reason": null,
  "next_stage": "squash-merge Stage 06 runtime after leaving Draft; post-merge main CI; Stage 07 remains locked",
  "last_updated": "2026-08-26T00:12:00+08:00",
  "last_voice_report": {
    "stage": "docs/voice-reports/stages/voice-reporting-foundation-voice-summary.md",
    "daily": "docs/voice-reports/daily/2026-08-25.md"
  },
  "evidence": {
    "sources": [
      "git",
      "github",
      "docs/stages/stage-06-decision-engine.md",
      "docs/management/reviews/stage-06-runtime-manager-review.md",
      "docs/voice-reports/evidence/2026-08-25.json",
      "PR #74 squash merge 0c5f23ba7cf4eee2841bfe817fe18930ef47d4d7"
    ],
    "main_head": "0c5f23ba7cf4eee2841bfe817fe18930ef47d4d7",
    "main_ci_run": "32870299400",
    "active_pr_head": "e65e9068b16913181ca460550fc9be813ca01748"
  }
}
